id,variant,tags,tier,rarity,fleet pts,op cost,formation,range,attackRunRange,attackPositionOffset,num,role,role desc,refit,base value,,,,,,,,,,,,,number
thunder_wing,thunder_Fighter,"interceptor2, interceptor, mid, rapid_reform, rare_bp, merc",2,,6,10,V,6000,500,900,2,INTERCEPTOR,Interceptor,15,7000,,,,,,,,,,,,,5
dagger_wing,dagger_Bomber,"bomber4, bomber, high, attack_at_an_angle, hightech_bp, merc",2,,5,18,V,4000,2000,600,3,BOMBER,Bomber,18,9000,,,,,,,,,,,,,11
trident_wing,trident_Bomber,"bomber6, bomber, high, attack_at_an_angle, rare_bp, hist1t, merc",3,0.25,8,25,V,4000,2000,600,2,BOMBER,Bomber,25,14000,,,,,,,,,,,,,13
longbow_wing,longbow_Support,"bomber3, bomber, high, attack_at_an_angle, rare_bp, merc",1,,5,12,V,4000,2000,100,2,BOMBER,Bomber,18,9000,,,,,,,,,,,,,15
mining_drone_wing,mining_drone_Standard,"support0, drone, low, base_bp, auto_fighter",0,,5,0,BOX,0,500,,4,SUPPORT,Drone,10,1500,,,,,,,,,,,,,17
